{"$schema":"https://json-schema.org/draft/2020-12/schema","title":"PolicyCanaryV1","type":"object","additionalProperties":false,"required":["schema_version","canary_id","baseline_identity","candidate_identity","baseline_cohort","candidate_cohort","guardrails","stop_thresholds","rollback_rule","owner_approval","live_traffic","auto_activate"],"properties":{"schema_version":{"const":"1.0"},"canary_id":{"type":"string"},"baseline_identity":{"type":"string"},"candidate_identity":{"type":"string"},"baseline_cohort":{"type":"string"},"candidate_cohort":{"type":"string"},"guardrails":{"type":"array","minItems":1,"items":{"type":"object","additionalProperties":false,"required":["metric","operator","threshold"],"properties":{"metric":{"type":"string"},"operator":{"enum":["lt","lte","gt","gte","eq"]},"threshold":{"type":"number"}}}},"stop_thresholds":{"type":"array","minItems":1,"items":{"type":"object","additionalProperties":false,"required":["metric","operator","threshold"],"properties":{"metric":{"type":"string"},"operator":{"enum":["lt","lte","gt","gte","eq"]},"threshold":{"type":"number"}}}},"rollback_rule":{"type":"string","minLength":1},"owner_approval":{"enum":["pending","approved","rejected"]},"live_traffic":{"const":false},"auto_activate":{"const":false}}}
