{"schema_version":"1.0","canary_id":"CAN-001","baseline_identity":"policy-v1","candidate_identity":"policy-v2","baseline_cohort":"fixed-fixture-a","candidate_cohort":"fixed-fixture-a","guardrails":[{"metric":"critical_failures","operator":"lte","threshold":0}],"stop_thresholds":[{"metric":"regressions","operator":"gte","threshold":1}],"rollback_rule":"Restore baseline identity and stop evaluation.","owner_approval":"pending","live_traffic":false,"auto_activate":false}
